{
  "schema_version": "2.3",
  "materialization_event_id": "efme_01J00000000000000000000018",
  "project_id": "efp_01J00000000000000000000001",
  "virtual_artifact_id": "efva_01J00000000000000000000017",
  "material_node_ref": "efn_01J00000000000000000000002@2",
  "event_kind": "copy",
  "asserted_by": {
    "kind": "user",
    "name": "project-owner",
    "version": null,
    "model": null
  },
  "authority_source_refs": [
    "efs_01J00000000000000000000008@1"
  ],
  "occurred_at": "2026-07-15T12:09:00Z",
  "notes": "Generated Markdown was copied into the project tree."
}
